{
  "schema_version": "1.3.3",
  "suite_id": "universal-uiux-engineering",
  "active_version": "1.3.3",
  "path_kind": "relative_to_skill_root",
  "suite_root": "../../uiux-suite/versions/1.3.3",
  "manifest_relpath": "RELEASE_MANIFEST.json",
  "python_exe": null,
  "created_by_installer": true,
  "created_at": "2026-10-23T12:00:00+00:00",
  "install_record_relpath": null
}
